{
  "schema_version": "1.0",
  "risk": "D",
  "workflow": "/root/work/agentic-selfcheck/.hermes/workflows/frontend-reference-aware-critic-smoke/good-d",
  "critique_source": "visual-critique.json",
  "design_quality_pack": {
    "reference_pack": "REFERENCE_PACK.md",
    "aesthetic_direction": "AESTHETIC_DIRECTION.md",
    "anti_patterns": "ANTI_PATTERNS.md",
    "design_tokens_map": "DESIGN_TOKENS_MAP.md",
    "component_inventory": "COMPONENT_INVENTORY.md",
    "project_frontend_rules": "PROJECT_FRONTEND_RULES.md"
  },
  "reference_alignment": {
    "references_used": [
      "ref1",
      "ref2",
      "ref3"
    ],
    "borrowed_principles": [
      "workflow clarity",
      "hierarchy"
    ],
    "not_copied_elements": [
      "brand assets"
    ],
    "score": 4.3
  },
  "aesthetic_alignment": {
    "score": 4.3,
    "matches": [
      "modern precise hierarchy"
    ],
    "gaps": []
  },
  "anti_pattern_check": {
    "violations": [],
    "avoided": [
      "generic dashboard shell"
    ],
    "score": 4.3
  },
  "token_component_fit": {
    "status": "contract_needed",
    "score": 4.3,
    "notes": [
      "synthetic smoke fixture"
    ]
  },
  "project_rules_alignment": {
    "score": 4.3,
    "matched_rules": [
      "preserve workflow IA"
    ],
    "violated_rules": []
  },
  "verdict": "PASS_WITH_NOTES",
  "required_changes": []
}